{
  "schema_version": "ATLAS_VISUAL_OBJECT_REGISTRY_V1",
  "registry_status": "candidate_registry_foundation",
  "objects": [
    {
      "object_id": "radar_workspace",
      "schema_version": "ATLAS_VISUAL_OBJECT_REGISTRY_V1",
      "status": "candidate",
      "semantic_role": "primary workspace surface",
      "variant_axes": ["size", "density", "state", "surface", "emphasis"],
      "token_bindings": {
        "surface": "token.surface.shell_panel",
        "surface_border": "token.border.soft",
        "surface_glow": "token.glow.moderate",
        "title": "token.color.accent.primary",
        "text": "token.color.text.primary"
      },
      "acceptance_criteria": [
        {
          "id": "radar_workspace.layout.balance",
          "statement": "The workspace registers a candidate radar surface with a balanced shell-panel layout."
        },
        {
          "id": "radar_workspace.registry.no_render_import",
          "statement": "The registry stays data-only and is not imported by render code in this first E3."
        }
      ],
      "implementation_mapping": [
        {
          "target": "frontend/src/workspaces/Radar.tsx",
          "kind": "future-implementation-map",
          "notes": "Registry target only; no import in this first E3."
        }
      ]
    },
    {
      "object_id": "radar_sweep_mark",
      "schema_version": "ATLAS_VISUAL_OBJECT_REGISTRY_V1",
      "status": "candidate",
      "semantic_role": "visual primitive",
      "variant_axes": ["size", "density", "tier", "motion", "state", "surface", "emphasis"],
      "token_bindings": {
        "ring": "token.color.border.soft",
        "sweep": "token.color.accent.primary",
        "accent": "token.color.accent.secondary",
        "motion_duration": "token.motion.sweep.duration",
        "motion_curve": "token.motion.sweep.curve"
      },
      "acceptance_criteria": [
        {
          "id": "radar_sweep_mark.registry.symbolic_tokens",
          "statement": "Sweep mark bindings stay symbolic and do not introduce raw hex, px, or duration literals."
        },
        {
          "id": "radar_sweep_mark.registry.variant_coverage",
          "statement": "The primitive exposes compact and workspace variants, including periodic and continuous motion modes."
        }
      ],
      "implementation_mapping": [
        {
          "target": "frontend/src/shell/RadarSweepMark.tsx",
          "kind": "future-implementation-map",
          "notes": "Registry target only; no import in this first E3."
        }
      ]
    },
    {
      "object_id": "signal_card",
      "schema_version": "ATLAS_VISUAL_OBJECT_REGISTRY_V1",
      "status": "candidate",
      "semantic_role": "reusable visual object",
      "variant_axes": ["size", "density", "tier", "motion", "state", "surface", "emphasis"],
      "token_bindings": {
        "surface": "token.surface.dark_panel",
        "surface_border": "token.border.soft",
        "accent": "token.color.accent.primary",
        "tier_relevant": "token.color.tier.relevant",
        "tier_emerging": "token.color.tier.emerging"
      },
      "acceptance_criteria": [
        {
          "id": "signal_card.registry.symbolic_tokens",
          "statement": "Signal card bindings stay symbolic and do not introduce raw hex, px, or duration literals."
        },
        {
          "id": "signal_card.registry.variant_coverage",
          "statement": "The registry covers standard and compact signal card variants and supports relevant and emerging tiers."
        }
      ],
      "implementation_mapping": [
        {
          "target": "frontend/src/workspaces/SignalCard.tsx",
          "kind": "future-implementation-map",
          "notes": "Registry target only; no import in this first E3."
        }
      ]
    },
    {
      "object_id": "panel_surface",
      "schema_version": "ATLAS_VISUAL_OBJECT_REGISTRY_V1",
      "status": "candidate",
      "semantic_role": "reusable visual object",
      "variant_axes": ["size", "density", "state", "surface", "emphasis"],
      "token_bindings": {
        "surface": "token.surface.dark_panel",
        "surface_border": "token.border.soft",
        "surface_glow": "token.glow.moderate",
        "text": "token.color.text.primary"
      },
      "acceptance_criteria": [
        {
          "id": "panel_surface.registry.symbolic_tokens",
          "statement": "Panel surface bindings stay symbolic and do not introduce raw hex, px, or duration literals."
        },
        {
          "id": "panel_surface.registry.variant_coverage",
          "statement": "The registry covers standard and compact panel surface variants across shell and dark panel contexts."
        }
      ],
      "implementation_mapping": [
        {
          "target": "frontend/src/shell/PanelSurface.tsx",
          "kind": "future-implementation-map",
          "notes": "Registry target only; no import in this package."
        }
      ]
    },
    {
      "object_id": "tier_badge",
      "schema_version": "ATLAS_VISUAL_OBJECT_REGISTRY_V1",
      "status": "candidate",
      "semantic_role": "reusable visual object",
      "variant_axes": ["size", "tier", "state", "emphasis"],
      "token_bindings": {
        "surface": "token.surface.raised",
        "label": "token.color.text.primary",
        "tier_relevant": "token.color.tier.relevant",
        "tier_emerging": "token.color.tier.emerging",
        "tier_neutral": "token.color.tier.neutral",
        "tier_warning": "token.color.tier.warning"
      },
      "acceptance_criteria": [
        {
          "id": "tier_badge.registry.symbolic_tokens",
          "statement": "Tier badge bindings stay symbolic and do not introduce raw hex, px, or duration literals."
        },
        {
          "id": "tier_badge.registry.variant_coverage",
          "statement": "The registry covers compact and standard tier badge variants across the relevant, emerging, neutral, and warning tiers."
        }
      ],
      "implementation_mapping": [
        {
          "target": "frontend/src/shell/TierBadge.tsx",
          "kind": "future-implementation-map",
          "notes": "Registry target only; no import in this package."
        }
      ]
    },
    {
      "object_id": "status_badge",
      "schema_version": "ATLAS_VISUAL_OBJECT_REGISTRY_V1",
      "status": "candidate",
      "semantic_role": "reusable visual object",
      "variant_axes": ["size", "tier", "state", "emphasis"],
      "token_bindings": {
        "surface": "token.surface.raised",
        "label": "token.color.text.primary",
        "status_relevant": "token.color.tier.relevant",
        "status_emerging": "token.color.tier.emerging",
        "status_neutral": "token.color.tier.neutral",
        "status_warning": "token.color.tier.warning"
      },
      "acceptance_criteria": [
        {
          "id": "status_badge.registry.symbolic_tokens",
          "statement": "Status badge bindings stay symbolic and do not introduce raw hex, px, or duration literals."
        },
        {
          "id": "status_badge.registry.variant_coverage",
          "statement": "The registry covers default and loading status badge variants across the neutral and warning tiers."
        }
      ],
      "implementation_mapping": [
        {
          "target": "frontend/src/shell/StatusBadge.tsx",
          "kind": "future-implementation-map",
          "notes": "Registry target only; no import in this package."
        }
      ]
    },
    {
      "object_id": "action_button",
      "schema_version": "ATLAS_VISUAL_OBJECT_REGISTRY_V1",
      "status": "candidate",
      "semantic_role": "reusable visual object",
      "variant_axes": ["size", "density", "state", "emphasis"],
      "token_bindings": {
        "surface": "token.surface.raised",
        "surface_border": "token.border.soft",
        "label": "token.color.accent.primary",
        "label_disabled": "token.color.text.muted"
      },
      "acceptance_criteria": [
        {
          "id": "action_button.registry.symbolic_tokens",
          "statement": "Action button bindings stay symbolic and do not introduce raw hex, px, or duration literals."
        },
        {
          "id": "action_button.registry.variant_coverage",
          "statement": "The registry covers standard and compact action button variants including hover and disabled states."
        }
      ],
      "implementation_mapping": [
        {
          "target": "frontend/src/shell/ActionButton.tsx",
          "kind": "future-implementation-map",
          "notes": "Registry target only; no import in this package."
        }
      ]
    },
    {
      "object_id": "icon_button",
      "schema_version": "ATLAS_VISUAL_OBJECT_REGISTRY_V1",
      "status": "candidate",
      "semantic_role": "reusable visual object",
      "variant_axes": ["size", "state", "emphasis"],
      "token_bindings": {
        "surface": "token.surface.raised",
        "icon": "token.color.accent.primary",
        "icon_disabled": "token.color.text.muted"
      },
      "acceptance_criteria": [
        {
          "id": "icon_button.registry.symbolic_tokens",
          "statement": "Icon button bindings stay symbolic and do not introduce raw hex, px, or duration literals."
        },
        {
          "id": "icon_button.registry.variant_coverage",
          "statement": "The registry covers compact and standard icon button variants including hover and disabled states."
        }
      ],
      "implementation_mapping": [
        {
          "target": "frontend/src/shell/IconButton.tsx",
          "kind": "future-implementation-map",
          "notes": "Registry target only; no import in this package."
        }
      ]
    },
    {
      "object_id": "context_rail",
      "schema_version": "ATLAS_VISUAL_OBJECT_REGISTRY_V1",
      "status": "candidate",
      "semantic_role": "contextual rail surface",
      "variant_axes": [
        "size",
        "density",
        "state",
        "surface",